[
  {
    "SchemaVersion": "1.0.0",
    "DataVersion": "2025-11-28",
    "Name": "Blinded",
    "ID": "COND_Blinded",
    "TypeTags": [
      "Condition.Blinded",
      "Condition.Debuff"
    ],
    "Description": "A blinded creature can't see and automatically fails any ability check that requires sight. Attack rolls against the creature have advantage, and the creature's attack rolls have disadvantage."
  },
  {
    "SchemaVersion": "1.0.0",
    "DataVersion": "2025-11-28",
    "Name": "Charmed",
    "ID": "COND_Charmed",
    "TypeTags": [
      "Condition.Charmed",
      "Condition.Debuff"
    ],
    "Description": "A charmed creature can't attack the charmer or target the charmer with harmful abilities or magical effects. The charmer has advantage on any ability check to interact socially with the creature."
  },
  {
    "SchemaVersion": "1.0.0",
    "DataVersion": "2025-11-28",
    "Name": "Deafened",
    "ID": "COND_Deafened",
    "TypeTags": [
      "Condition.Deafened",
      "Condition.Debuff"
    ],
    "Description": "A deafened creature can't hear and automatically fails any ability check that requires hearing."
  },
  {
    "SchemaVersion": "1.0.0",
    "DataVersion": "2025-11-28",
    "Name": "Frightened",
    "ID": "COND_Frightened",
    "TypeTags": [
      "Condition.Frightened",
      "Condition.Debuff"
    ],
    "Description": "A frightened creature has disadvantage on ability checks and attack rolls while the source of its fear is within line of sight. The creature can't willingly move closer to the source of its fear."
  },
  {
    "SchemaVersion": "1.0.0",
    "DataVersion": "2025-11-28",
    "Name": "Grappled",
    "ID": "COND_Grappled",
    "TypeTags": [
      "Condition.Grappled",
      "Condition.Debuff"
    ],
    "Description": "A grappled creature's speed becomes 0, and it can't benefit from any bonus to its speed. The condition ends if the grappler is incapacitated or if an effect removes the grappled creature from the reach of the grappler or grappling effect."
  },
  {
    "SchemaVersion": "1.0.0",
    "DataVersion": "2025-11-28",
    "Name": "Incapacitated",
    "ID": "COND_Incapacitated",
    "TypeTags": [
      "Condition.Incapacitated",
      "Condition.Debuff"
    ],
    "Description": "An incapacitated creature can't take actions or reactions."
  },
  {
    "SchemaVersion": "1.0.0",
    "DataVersion": "2025-11-28",
    "Name": "Invisible",
    "ID": "COND_Invisible",
    "TypeTags": [
      "Condition.Invisible"
    ],
    "Description": "An invisible creature is impossible to see without the aid of magic or a special sense. For the purpose of hiding, the creature is heavily obscured. The creature's location can be detected by any noise it makes or any tracks it leaves. Attack rolls against the creature have disadvantage, and the creature's attack rolls have advantage."
  },
  {
    "SchemaVersion": "1.0.0",
    "DataVersion": "2025-11-28",
    "Name": "Paralyzed",
    "ID": "COND_Paralyzed",
    "TypeTags": [
      "Condition.Paralyzed",
      "Condition.Debuff"
    ],
    "Description": "A paralyzed creature is incapacitated and can't move or speak. The creature automatically fails Strength and Dexterity saving throws. Attack rolls against the creature have advantage. Any attack that hits the creature is a critical hit if the attacker is within 5 feet of the creature."
  },
  {
    "SchemaVersion": "1.0.0",
    "DataVersion": "2025-11-28",
    "Name": "Petrified",
    "ID": "COND_Petrified",
    "TypeTags": [
      "Condition.Petrified",
      "Condition.Debuff"
    ],
    "Description": "A petrified creature is transformed, along with any nonmagical object it is wearing or carrying, into a solid inanimate substance (usually stone). Its weight increases by a factor of ten, and it ceases aging. The creature is incapacitated, can't move or speak, and is unaware of its surroundings. Attack rolls against the creature have advantage. The creature automatically fails Strength and Dexterity saving throws. The creature has resistance to all damage. The creature is immune to poison and disease, although a poison or disease already in its system is suspended, not neutralized."
  },
  {
    "SchemaVersion": "1.0.0",
    "DataVersion": "2025-11-28",
    "Name": "Poisoned",
    "ID": "COND_Poisoned",
    "TypeTags": [
      "Condition.Poisoned",
      "Condition.Debuff"
    ],
    "Description": "A poisoned creature has disadvantage on attack rolls and ability checks."
  },
  {
    "SchemaVersion": "1.0.0",
    "DataVersion": "2025-11-28",
    "Name": "Prone",
    "ID": "COND_Prone",
    "TypeTags": [
      "Condition.Prone",
      "Condition.Debuff"
    ],
    "Description": "A prone creature's only movement option is to crawl, unless it stands up and thereby ends the condition. The creature has disadvantage on attack rolls. An attack roll against the creature has advantage if the attacker is within 5 feet of the creature. Otherwise, the attack roll has disadvantage."
  },
  {
    "SchemaVersion": "1.0.0",
    "DataVersion": "2025-11-28",
    "Name": "Restrained",
    "ID": "COND_Restrained",
    "TypeTags": [
      "Condition.Restrained",
      "Condition.Debuff"
    ],
    "Description": "A restrained creature's speed becomes 0, and it can't benefit from any bonus to its speed. Attack rolls against the creature have advantage, and the creature's attack rolls have disadvantage. The creature has disadvantage on Dexterity saving throws."
  },
  {
    "SchemaVersion": "1.0.0",
    "DataVersion": "2025-11-28",
    "Name": "Stunned",
    "ID": "COND_Stunned",
    "TypeTags": [
      "Condition.Stunned",
      "Condition.Debuff"
    ],
    "Description": "A stunned creature is incapacitated, can't move, and can speak only falteringly. The creature automatically fails Strength and Dexterity saving throws. Attack rolls against the creature have advantage."
  },
  {
    "SchemaVersion": "1.0.0",
    "DataVersion": "2025-11-28",
    "Name": "Unconscious",
    "ID": "COND_Unconscious",
    "TypeTags": [
      "Condition.Unconscious",
      "Condition.Debuff"
    ],
    "Description": "An unconscious creature is incapacitated, can't move or speak, and is unaware of its surroundings. The creature drops whatever it's holding and falls prone. The creature automatically fails Strength and Dexterity saving throws. Attack rolls against the creature have advantage. Any attack that hits the creature is a critical hit if the attacker is within 5 feet of the creature."
  }
]